[
  {
    "slug": "river-strand",
    "name": "River Strand",
    "bio": "River Strand works in the space between the botanical and the surreal, weaving intricate linework with Art Nouveau-inspired forms. Their gallery-quality paintings layer organic motifs with muted pastel palettes that reward sustained attention.",
    "artistStatement": "I seek to capture the in-between—the moment before form settles, where possibility still breathes.",
    "portraitUrl": "/images/artists/river-strand/portrait.png",
    "studioImageUrls": [],
    "influences": [
      "James Jean",
      "Art Nouveau",
      "Botanical illustration"
    ],
    "style": {
      "medium": "Oil and ink on canvas",
      "palette": "Muted pastels, ivory, sage, dusty rose",
      "subjects": "Botanical and figurative surrealism"
    },
    "pricingTier": "premium",
    "defaultEditionSize": 25
  },
  {
    "slug": "ren-cross",
    "name": "Ren Cross",
    "bio": "Ren Cross brings a cinematic darkness to portraiture, painting uncanny figures that hover between folk tale and dream. Deeply influenced by classic illustration, their work transforms the antique into something quietly unsettling.",
    "artistStatement": "Every face holds a story older than the person wearing it.",
    "portraitUrl": "/images/artists/ren-cross/portrait.png",
    "studioImageUrls": [],
    "influences": [
      "Travis Louie",
      "Victorian illustration",
      "Silent film"
    ],
    "style": {
      "medium": "Gouache on panel",
      "palette": "Sepia, slate, pale gold",
      "subjects": "Gothic portraiture and creature studies"
    },
    "pricingTier": "mid-range",
    "defaultEditionSize": 25
  },
  {
    "slug": "elara-nakamura",
    "name": "Elara Nakamura",
    "bio": "Elara Nakamura merges Japanese woodblock tradition with Art Nouveau sinuousness, producing luminous figures that feel both ancient and contemporary. Her graceful compositions have drawn collectors from across the Pacific Rim.",
    "artistStatement": "Beauty is a discipline—every line must earn its place.",
    "portraitUrl": "/images/artists/elara-nakamura/portrait.png",
    "studioImageUrls": [],
    "influences": [
      "Audrey Kawasaki",
      "Mucha",
      "Hokusai"
    ],
    "style": {
      "medium": "Ink and wood stain on birch panel",
      "palette": "Ivory, cherry blossom, deep lacquer",
      "subjects": "Female figures with floral and natural motifs"
    },
    "pricingTier": "premium",
    "defaultEditionSize": 20
  },
  {
    "slug": "nova-ash",
    "name": "Nova Ash",
    "bio": "Nova Ash paints softly luminous dreamscapes where figures dissolve into forests and starfields. Her work has a quality of remembered childhood wonder—approachable yet quietly melancholic.",
    "artistStatement": "I paint the places I go when I close my eyes.",
    "portraitUrl": "/images/artists/nova-ash/portrait.png",
    "studioImageUrls": [],
    "influences": [
      "Amy Sol",
      "Studio Ghibli",
      "Edward Lear"
    ],
    "style": {
      "medium": "Acrylic on canvas",
      "palette": "Lavender, gold, soft teal",
      "subjects": "Dreamy figures in natural environments"
    },
    "pricingTier": "affordable",
    "defaultEditionSize": 30
  },
  {
    "slug": "elara-chen",
    "name": "Elara Chen",
    "bio": "Elara Chen fuses street art energy with fine art craft, building high-contrast works that carry the visual weight of propaganda posters and the emotional depth of protest art. Her bold compositions demand attention.",
    "artistStatement": "Art without urgency is decoration. I want my work to mean something.",
    "portraitUrl": "/images/artists/elara-chen/portrait.png",
    "studioImageUrls": [],
    "influences": [
      "Shepard Fairey",
      "Constructivism",
      "Street art"
    ],
    "style": {
      "medium": "Mixed media on canvas",
      "palette": "Red, black, cream, gold",
      "subjects": "Graphic figurative and political imagery"
    },
    "pricingTier": "mid-range",
    "defaultEditionSize": 25
  },
  {
    "slug": "vera-voss",
    "name": "Vera Voss",
    "bio": "Vera Voss paints luminous figurative works of extraordinary technical refinement—gilded surfaces, cascading fabric, and translucent glazes that recall Old Master technique in a contemporary context. Her pieces are among the most sought-after in the collection.",
    "artistStatement": "Light is the subject. Everything else is just its occasion.",
    "portraitUrl": "/images/artists/vera-voss/portrait.png",
    "studioImageUrls": [],
    "influences": [
      "Brad Kunkle",
      "Klimt",
      "Vermeer"
    ],
    "style": {
      "medium": "Oil and gold leaf on panel",
      "palette": "Gold, ivory, deep burgundy",
      "subjects": "Romantic figurative with gilded detail"
    },
    "pricingTier": "premium",
    "defaultEditionSize": 15
  },
  {
    "slug": "leo-vale",
    "name": "Leo Vale",
    "bio": "Leo Vale is an artist whose work draws on Stella Im Hultberg-inspired contemporary art with distinctive visual style and technique. Their pieces explore the boundaries between tradition and contemporary expression, creating compositions that invite contemplation and connection.",
    "artistStatement": "I seek to capture the in-between—the moment before form settles, where possibility still breathes.",
    "portraitUrl": "/images/artists/leo-vale/portrait.png",
    "studioImageUrls": [],
    "influences": [
      "Stella Im Hultberg"
    ],
    "style": {
      "medium": "Digital oil on canvas",
      "palette": "varied",
      "subjects": "Stella Im Hultberg-inspired contemporary art with distinctive visual style and technique"
    },
    "pricingTier": "mid-range",
    "defaultEditionSize": 20
  }
]